{
  "amendments": [],
  "current_components": [
    {
      "component_id": "ajv-8-20-0-installed",
      "legal_source": {
        "digest": "a05350a88e318e4f5f2c2a1ff1e2e88daa4dd38e6e78b71cccae422bdc762cc3",
        "payload_path": "legal/upstream/installed-ajv-8.20.0/LICENSE",
        "source_path": "release/legal/upstream/installed-ajv-8.20.0/LICENSE"
      },
      "license_expression": "MIT",
      "package_identity": {
        "authority": "package-lock",
        "integrity": "sha512-Thbli+OlOj+iMPYFBVBfJ3OmCAnaSyNn4M1vz9T6Gka5Jt9ba/HIR56joy65tY6kx/FCF5VXNB819Y7/GUrBGA==",
        "tarball_url": "https://registry.npmjs.org/ajv/-/ajv-8.20.0.tgz"
      },
      "package_name": "ajv",
      "package_version": "8.20.0",
      "provenance_inputs": [
        {
          "package_name": "ajv",
          "package_relative_path": "LICENSE",
          "package_version": "8.20.0"
        },
        {
          "package_name": "ajv",
          "package_relative_path": "package.json",
          "package_version": "8.20.0"
        }
      ],
      "provenance_kind": "installed",
      "source_map_expected": false,
      "source_root": "node_modules/ajv"
    },
    {
      "component_id": "ajv-embedded",
      "legal_source": {
        "digest": "a05350a88e318e4f5f2c2a1ff1e2e88daa4dd38e6e78b71cccae422bdc762cc3",
        "payload_path": "legal/upstream/ajv-8.18.0/LICENSE",
        "source_path": "release/legal/upstream/ajv-8.18.0/LICENSE"
      },
      "license_expression": "MIT",
      "package_identity": {
        "authority": "npm-registry-artifact",
        "integrity": "sha512-PlXPeEWMXMZ7sPYOHqmDyCJzcfNrUr3fGNKtezX14ykXOEIvyK81d+qydx89KY5O71FKMPaQ2vBfBFI5NHR63A==",
        "tarball_url": "https://registry.npmjs.org/ajv/-/ajv-8.18.0.tgz"
      },
      "package_name": "ajv",
      "package_version": "8.18.0",
      "provenance_inputs": [
        {
          "package_name": "@modelcontextprotocol/server",
          "package_relative_path": "dist/ajvProvider-CEoC__sr.mjs.map",
          "package_version": "2.0.0"
        }
      ],
      "provenance_kind": "embedded",
      "source_map_expected": true,
      "source_root": "ajv/lib"
    },
    {
      "component_id": "ajv-formats-3-0-1-installed",
      "legal_source": {
        "digest": "9df3bb69929a3b650ed73b3bfa1756725aaff0ac296461605753547004eafeaf",
        "payload_path": "legal/upstream/installed-ajv-formats-3.0.1/LICENSE",
        "source_path": "release/legal/upstream/installed-ajv-formats-3.0.1/LICENSE"
      },
      "license_expression": "MIT",
      "package_identity": {
        "authority": "package-lock",
        "integrity": "sha512-8iUql50EUR+uUcdRQ3HDqa6EVyo3docL8g5WJ3FNcWmu62IbkGUue/pEyLBW8VGKKucTPgqeks4fIU1DA4yowQ==",
        "tarball_url": "https://registry.npmjs.org/ajv-formats/-/ajv-formats-3.0.1.tgz"
      },
      "package_name": "ajv-formats",
      "package_version": "3.0.1",
      "provenance_inputs": [
        {
          "package_name": "ajv-formats",
          "package_relative_path": "LICENSE",
          "package_version": "3.0.1"
        },
        {
          "package_name": "ajv-formats",
          "package_relative_path": "package.json",
          "package_version": "3.0.1"
        }
      ],
      "provenance_kind": "installed",
      "source_map_expected": false,
      "source_root": "node_modules/ajv-formats"
    },
    {
      "component_id": "ajv-formats-embedded",
      "legal_source": {
        "digest": "9df3bb69929a3b650ed73b3bfa1756725aaff0ac296461605753547004eafeaf",
        "payload_path": "legal/upstream/ajv-formats-3.0.1/LICENSE",
        "source_path": "release/legal/upstream/ajv-formats-3.0.1/LICENSE"
      },
      "license_expression": "MIT",
      "package_identity": {
        "authority": "npm-registry-artifact",
        "integrity": "sha512-8iUql50EUR+uUcdRQ3HDqa6EVyo3docL8g5WJ3FNcWmu62IbkGUue/pEyLBW8VGKKucTPgqeks4fIU1DA4yowQ==",
        "tarball_url": "https://registry.npmjs.org/ajv-formats/-/ajv-formats-3.0.1.tgz"
      },
      "package_name": "ajv-formats",
      "package_version": "3.0.1",
      "provenance_inputs": [
        {
          "package_name": "@modelcontextprotocol/server",
          "package_relative_path": "dist/ajvProvider-CEoC__sr.mjs.map",
          "package_version": "2.0.0"
        }
      ],
      "provenance_kind": "embedded",
      "source_map_expected": true,
      "source_root": "ajv-formats/src"
    },
    {
      "component_id": "boundary-2-0-0-installed",
      "legal_source": {
        "digest": "0e74697a68cebdcd61502c30fe80ab7f9e341d995dcd452023654d57133534b1",
        "payload_path": "legal/upstream/installed-boundary-2.0.0/LICENSE.BSD",
        "source_path": "release/legal/upstream/installed-boundary-2.0.0/LICENSE.BSD"
      },
      "license_expression": "BSD-2-Clause",
      "package_identity": {
        "authority": "package-lock",
        "integrity": "sha512-rJKn5ooC9u8q13IMCrW0RSp31pxBCHE3y9V/tp3TdWSLf8Em3p6Di4NBpfzbJge9YjjFEsD0RtFEjtvHL5VyEA==",
        "tarball_url": "https://registry.npmjs.org/boundary/-/boundary-2.0.0.tgz"
      },
      "package_name": "boundary",
      "package_version": "2.0.0",
      "provenance_inputs": [
        {
          "package_name": "boundary",
          "package_relative_path": "LICENSE.BSD",
          "package_version": "2.0.0"
        },
        {
          "package_name": "boundary",
          "package_relative_path": "package.json",
          "package_version": "2.0.0"
        }
      ],
      "provenance_kind": "installed",
      "source_map_expected": false,
      "source_root": "node_modules/boundary"
    },
    {
      "component_id": "content-type-embedded",
      "legal_source": {
        "digest": "257aed98914108e91a337912727b6a802eef218248507f74b76faffaff517a38",
        "payload_path": "legal/upstream/content-type-1.0.5/LICENSE",
        "source_path": "release/legal/upstream/content-type-1.0.5/LICENSE"
      },
      "license_expression": "MIT",
      "package_identity": {
        "authority": "npm-registry-artifact",
        "integrity": "sha512-nTjqfcBFEipKdXCv4YDQWCfmcLZKm81ldF0pAopTvyrFGVbcR6P/VAAd5G7N+0tTr8QqiU0tFadD6FK4NtJwOA==",
        "tarball_url": "https://registry.npmjs.org/content-type/-/content-type-1.0.5.tgz"
      },
      "package_name": "content-type",
      "package_version": "1.0.5",
      "provenance_inputs": [
        {
          "package_name": "@modelcontextprotocol/server",
          "package_relative_path": "dist/src-CX2iR2pK.mjs.map",
          "package_version": "2.0.0"
        }
      ],
      "provenance_kind": "embedded",
      "source_map_expected": true,
      "source_root": "content-type"
    },
    {
      "component_id": "debug-4-4-3-installed",
      "legal_source": {
        "digest": "3a61c6c96caf5c1d9b623fb9b04c822b783dfcb78aa7e49c76a3f643e6ed7f95",
        "payload_path": "legal/upstream/installed-debug-4.4.3/LICENSE",
        "source_path": "release/legal/upstream/installed-debug-4.4.3/LICENSE"
      },
      "license_expression": "MIT",
      "package_identity": {
        "authority": "package-lock",
        "integrity": "sha512-RGwwWnwQvkVfavKVt22FGLw+xYSdzARwm0ru6DhTVA3umU5hZc28V3kO4stgYryrTlLpuvgI9GiijltAjNbcqA==",
        "tarball_url": "https://registry.npmjs.org/debug/-/debug-4.4.3.tgz"
      },
      "package_name": "debug",
      "package_version": "4.4.3",
      "provenance_inputs": [
        {
          "package_name": "debug",
          "package_relative_path": "LICENSE",
          "package_version": "4.4.3"
        },
        {
          "package_name": "debug",
          "package_relative_path": "package.json",
          "package_version": "4.4.3"
        }
      ],
      "provenance_kind": "installed",
      "source_map_expected": false,
      "source_root": "node_modules/debug"
    },
    {
      "component_id": "fast-deep-equal-3-1-3-installed",
      "legal_source": {
        "digest": "7bf9b2de73a6b356761c948d0e9eeb4be6c1270bd04c79cd489c1e400ffdfc1a",
        "payload_path": "legal/upstream/installed-fast-deep-equal-3.1.3/LICENSE",
        "source_path": "release/legal/upstream/installed-fast-deep-equal-3.1.3/LICENSE"
      },
      "license_expression": "MIT",
      "package_identity": {
        "authority": "package-lock",
        "integrity": "sha512-f3qQ9oQy9j2AhBe/H9VC91wLmKBCCU/gDOnKNAYG5hswO7BLKj09Hc5HYNz9cGI++xlpDCIgDaitVs03ATR84Q==",
        "tarball_url": "https://registry.npmjs.org/fast-deep-equal/-/fast-deep-equal-3.1.3.tgz"
      },
      "package_name": "fast-deep-equal",
      "package_version": "3.1.3",
      "provenance_inputs": [
        {
          "package_name": "fast-deep-equal",
          "package_relative_path": "LICENSE",
          "package_version": "3.1.3"
        },
        {
          "package_name": "fast-deep-equal",
          "package_relative_path": "package.json",
          "package_version": "3.1.3"
        }
      ],
      "provenance_kind": "installed",
      "source_map_expected": false,
      "source_root": "node_modules/fast-deep-equal"
    },
    {
      "component_id": "fast-deep-equal-embedded",
      "legal_source": {
        "digest": "7bf9b2de73a6b356761c948d0e9eeb4be6c1270bd04c79cd489c1e400ffdfc1a",
        "payload_path": "legal/upstream/fast-deep-equal-3.1.3/LICENSE",
        "source_path": "release/legal/upstream/fast-deep-equal-3.1.3/LICENSE"
      },
      "license_expression": "MIT",
      "package_identity": {
        "authority": "npm-registry-artifact",
        "integrity": "sha512-f3qQ9oQy9j2AhBe/H9VC91wLmKBCCU/gDOnKNAYG5hswO7BLKj09Hc5HYNz9cGI++xlpDCIgDaitVs03ATR84Q==",
        "tarball_url": "https://registry.npmjs.org/fast-deep-equal/-/fast-deep-equal-3.1.3.tgz"
      },
      "package_name": "fast-deep-equal",
      "package_version": "3.1.3",
      "provenance_inputs": [
        {
          "package_name": "@modelcontextprotocol/server",
          "package_relative_path": "dist/ajvProvider-CEoC__sr.mjs.map",
          "package_version": "2.0.0"
        }
      ],